{"authority_boundary":{"may_change_fpo_authority":false,"return_only":true},"capability_id":"ai.human-last-boundary.capability","capability_revision":"phase4c-v1","capability_run_id":"human-last-C1-002","case_id":"C1","dispatch_id":"DISP-C1-002","fixture_ref":"phase4c/fixtures/C1-local-policy.json","operation_id":"OP-C1-002","return_schema_ref":"phase4c/contracts/decision_return.schema.json","run_number":2,"schema":"fpo.phase4c.research-dispatch.v1"}
